ID,Description,GeneRatio,BgRatio,RichFactor,FoldEnrichment,zScore,pvalue,p.adjust,qvalue,geneID,Count,ontology,group_label
GO:0090130,tissue migration,2/23,110/18860,0.0181818181818182,14.9090909090909,5.11224703337679,0.00787311066452885,0.215518917085157,0.177701063788955,ACTA2/FGF7,2,BP,aortic aneurysm and dissection
GO:0006924,activation-induced cell death of T cells,1/23,10/18860,0.1,82,8.95254929412783,0.0121312936190364,0.215518917085157,0.177701063788955,FAS,1,BP,aortic aneurysm and dissection
GO:0060346,bone trabecula formation,1/23,10/18860,0.1,82,8.95254929412783,0.0121312936190364,0.215518917085157,0.177701063788955,FBN2,1,BP,aortic aneurysm and dissection
GO:2000234,positive regulation of rRNA processing,1/23,10/18860,0.1,82,8.95254929412783,0.0121312936190364,0.215518917085157,0.177701063788955,WDR75,1,BP,aortic aneurysm and dissection
GO:0000338,protein deneddylation,1/23,11/18860,0.0909090909090909,74.5454545454546,8.52560880293222,0.0133366506613045,0.215518917085157,0.177701063788955,COPS2,1,BP,aortic aneurysm and dissection
GO:0034115,negative regulation of heterotypic cell-cell adhesion,1/23,11/18860,0.0909090909090909,74.5454545454546,8.52560880293222,0.0133366506613045,0.215518917085157,0.177701063788955,MAP2K5,1,BP,aortic aneurysm and dissection
GO:0035581,sequestering of extracellular ligand from receptor,1/23,11/18860,0.0909090909090909,74.5454545454546,8.52560880293222,0.0133366506613045,0.215518917085157,0.177701063788955,FBN2,1,BP,aortic aneurysm and dissection
GO:0042996,regulation of Golgi to plasma membrane protein transport,1/23,12/18860,0.0833333333333333,68.3333333333333,8.15277544542366,0.014540600846184,0.215518917085157,0.177701063788955,LYPLAL1,1,BP,aortic aneurysm and dissection
GO:0048671,negative regulation of collateral sprouting,1/23,12/18860,0.0833333333333333,68.3333333333333,8.15277544542366,0.014540600846184,0.215518917085157,0.177701063788955,DCC,1,BP,aortic aneurysm and dissection
GO:0051549,positive regulation of keratinocyte migration,1/23,12/18860,0.0833333333333333,68.3333333333333,8.15277544542366,0.014540600846184,0.215518917085157,0.177701063788955,FGF7,1,BP,aortic aneurysm and dissection
GO:0060502,epithelial cell proliferation involved in lung morphogenesis,1/23,12/18860,0.0833333333333333,68.3333333333333,8.15277544542366,0.014540600846184,0.215518917085157,0.177701063788955,FGF7,1,BP,aortic aneurysm and dissection
GO:1904238,pericyte cell differentiation,1/23,12/18860,0.0833333333333333,68.3333333333333,8.15277544542366,0.014540600846184,0.215518917085157,0.177701063788955,ACTA2,1,BP,aortic aneurysm and dissection
GO:0003183,mitral valve morphogenesis,1/23,13/18860,0.0769230769230769,63.0769230769231,7.82344660166955,0.0157431457411621,0.215518917085157,0.177701063788955,ADAMTS19,1,BP,aortic aneurysm and dissection
GO:0006012,galactose metabolic process,1/23,13/18860,0.0769230769230769,63.0769230769231,7.82344660166955,0.0157431457411621,0.215518917085157,0.177701063788955,GALK2,1,BP,aortic aneurysm and dissection
GO:0036295,cellular response to increased oxygen levels,1/23,13/18860,0.0769230769230769,63.0769230769231,7.82344660166955,0.0157431457411621,0.215518917085157,0.177701063788955,FAS,1,BP,aortic aneurysm and dissection
GO:0061430,bone trabecula morphogenesis,1/23,13/18860,0.0769230769230769,63.0769230769231,7.82344660166955,0.0157431457411621,0.215518917085157,0.177701063788955,FBN2,1,BP,aortic aneurysm and dissection
GO:0009615,response to virus,3/23,445/18860,0.00674157303370787,5.52808988764045,3.37774268998201,0.0162741706990336,0.215518917085157,0.177701063788955,ACTA2/IFIT2/IFIT1B,3,BP,aortic aneurysm and dissection
GO:0098734,macromolecule depalmitoylation,1/23,14/18860,0.0714285714285714,58.5714285714286,7.52971970724307,0.0169442869120618,0.215518917085157,0.177701063788955,LYPLAL1,1,BP,aortic aneurysm and dissection
GO:1903251,multi-ciliated epithelial cell differentiation,1/23,14/18860,0.0714285714285714,58.5714285714286,7.52971970724307,0.0169442869120618,0.215518917085157,0.177701063788955,CEP152,1,BP,aortic aneurysm and dissection
GO:0001833,inner cell mass cell proliferation,1/23,15/18860,0.0666666666666667,54.6666666666667,7.26556779155716,0.0181440259230472,0.215518917085157,0.177701063788955,COPS2,1,BP,aortic aneurysm and dissection
GO:0090206,negative regulation of cholesterol metabolic process,1/23,15/18860,0.0666666666666667,54.6666666666667,7.26556779155716,0.0181440259230472,0.215518917085157,0.177701063788955,CH25H,1,BP,aortic aneurysm and dissection
GO:2000288,positive regulation of myoblast proliferation,1/23,15/18860,0.0666666666666667,54.6666666666667,7.26556779155716,0.0181440259230472,0.215518917085157,0.177701063788955,FGF7,1,BP,aortic aneurysm and dissection
GO:0010763,positive regulation of fibroblast migration,1/23,16/18860,0.0625,51.25,7.02630323911402,0.019342364336619,0.215518917085157,0.177701063788955,ACTA2,1,BP,aortic aneurysm and dissection
GO:0072537,fibroblast activation,1/23,16/18860,0.0625,51.25,7.02630323911402,0.019342364336619,0.215518917085157,0.177701063788955,ACTA2,1,BP,aortic aneurysm and dissection
GO:0010838,positive regulation of keratinocyte proliferation,1/23,17/18860,0.0588235294117647,48.2352941176471,6.80821778742744,0.0205393037136231,0.215518917085157,0.177701063788955,FGF7,1,BP,aortic aneurysm and dissection
GO:0072109,glomerular mesangium development,1/23,17/18860,0.0588235294117647,48.2352941176471,6.80821778742744,0.0205393037136231,0.215518917085157,0.177701063788955,ACTA2,1,BP,aortic aneurysm and dissection
GO:0044539,long-chain fatty acid import into cell,1/23,18/18860,0.0555555555555556,45.5555555555556,6.60833415667206,0.0217348456132453,0.215518917085157,0.177701063788955,SLC27A6,1,BP,aortic aneurysm and dissection
GO:0071499,cellular response to laminar fluid shear stress,1/23,18/18860,0.0555555555555556,45.5555555555556,6.60833415667206,0.0217348456132453,0.215518917085157,0.177701063788955,MAP2K5,1,BP,aortic aneurysm and dissection
GO:0160049,negative regulation of cGAS/STING signaling pathway,1/23,18/18860,0.0555555555555556,45.5555555555556,6.60833415667206,0.0217348456132453,0.215518917085157,0.177701063788955,LYPLAL1,1,BP,aortic aneurysm and dissection
GO:1901163,regulation of trophoblast cell migration,1/23,18/18860,0.0555555555555556,45.5555555555556,6.60833415667206,0.0217348456132453,0.215518917085157,0.177701063788955,FBN2,1,BP,aortic aneurysm and dissection
GO:0034392,negative regulation of smooth muscle cell apoptotic process,1/23,19/18860,0.0526315789473684,43.1578947368421,6.42423057775922,0.0229289915930192,0.215518917085157,0.177701063788955,MAP2K5,1,BP,aortic aneurysm and dissection
GO:0055093,response to hyperoxia,1/23,19/18860,0.0526315789473684,43.1578947368421,6.42423057775922,0.0229289915930192,0.215518917085157,0.177701063788955,FAS,1,BP,aortic aneurysm and dissection
GO:0051546,keratinocyte migration,1/23,20/18860,0.05,41,6.25391420896537,0.0241217432088227,0.215518917085157,0.177701063788955,FGF7,1,BP,aortic aneurysm and dissection
GO:2000434,regulation of protein neddylation,1/23,20/18860,0.05,41,6.25391420896537,0.0241217432088227,0.215518917085157,0.177701063788955,COPS2,1,BP,aortic aneurysm and dissection
GO:0046596,regulation of viral entry into host cell,1/23,21/18860,0.0476190476190476,39.047619047619,6.09572811694793,0.0253131020148842,0.215518917085157,0.177701063788955,CH25H,1,BP,aortic aneurysm and dissection
GO:0072567,chemokine (C-X-C motif) ligand 2 production,1/23,21/18860,0.0476190476190476,39.047619047619,6.09572811694793,0.0253131020148842,0.215518917085157,0.177701063788955,MAP2K5,1,BP,aortic aneurysm and dissection
GO:0097049,motor neuron apoptotic process,1/23,21/18860,0.0476190476190476,39.047619047619,6.09572811694793,0.0253131020148842,0.215518917085157,0.177701063788955,FAS,1,BP,aortic aneurysm and dissection
GO:1903428,positive regulation of reactive oxygen species biosynthetic process,1/23,21/18860,0.0476190476190476,39.047619047619,6.09572811694793,0.0253131020148842,0.215518917085157,0.177701063788955,FAS,1,BP,aortic aneurysm and dissection
GO:0034616,response to laminar fluid shear stress,1/23,22/18860,0.0454545454545455,37.2727272727273,5.94828178610247,0.0265030695637807,0.215518917085157,0.177701063788955,MAP2K5,1,BP,aortic aneurysm and dissection
GO:0060445,branching involved in salivary gland morphogenesis,1/23,22/18860,0.0454545454545455,37.2727272727273,5.94828178610247,0.0265030695637807,0.215518917085157,0.177701063788955,FGF7,1,BP,aortic aneurysm and dissection
GO:0034114,regulation of heterotypic cell-cell adhesion,1/23,23/18860,0.0434782608695652,35.6521739130435,5.81039843092701,0.027691647406441,0.215518917085157,0.177701063788955,MAP2K5,1,BP,aortic aneurysm and dissection
GO:0046835,carbohydrate phosphorylation,1/23,24/18860,0.0416666666666667,34.1666666666667,5.68107451102658,0.0288788370921474,0.215518917085157,0.177701063788955,GALK2,1,BP,aortic aneurysm and dissection
GO:0016973,poly(A)+ mRNA export from nucleus,1/23,25/18860,0.04,32.8,5.55944824310633,0.0300646401685374,0.215518917085157,0.177701063788955,ZC3H11B,1,BP,aortic aneurysm and dissection
GO:0014829,vascular associated smooth muscle contraction,1/23,27/18860,0.037037037037037,30.3703703703704,5.33640683082287,0.0324320926757014,0.215518917085157,0.177701063788955,ACTA2,1,BP,aortic aneurysm and dissection
GO:0045116,protein neddylation,1/23,28/18860,0.0357142857142857,29.2857142857143,5.2337783039622,0.0336137451935407,0.215518917085157,0.177701063788955,COPS2,1,BP,aortic aneurysm and dissection
GO:0090128,regulation of synapse maturation,1/23,28/18860,0.0357142857142857,29.2857142857143,5.2337783039622,0.0336137451935407,0.215518917085157,0.177701063788955,FGF7,1,BP,aortic aneurysm and dissection
GO:1903077,negative regulation of protein localization to plasma membrane,1/23,30/18860,0.0333333333333333,27.3333333333333,5.04380959275216,0.0359729104631021,0.215518917085157,0.177701063788955,LYPLAL1,1,BP,aortic aneurysm and dissection
GO:0032682,negative regulation of chemokine production,1/23,32/18860,0.03125,25.625,4.87154269227827,0.0383265662992485,0.215518917085157,0.177701063788955,MAP2K5,1,BP,aortic aneurysm and dissection
GO:0099170,postsynaptic modulation of chemical synaptic transmission,1/23,32/18860,0.03125,25.625,4.87154269227827,0.0383265662992485,0.215518917085157,0.177701063788955,DCC,1,BP,aortic aneurysm and dissection
GO:0051450,myoblast proliferation,1/23,33/18860,0.0303030303030303,24.8484848484849,4.79120309359901,0.0395013320191931,0.215518917085157,0.177701063788955,FGF7,1,BP,aortic aneurysm and dissection
GO:0031069,hair follicle morphogenesis,1/23,34/18860,0.0294117647058824,24.1176470588235,4.71434585003194,0.0406747249848036,0.215518917085157,0.177701063788955,FGF7,1,BP,aortic aneurysm and dissection
GO:0140896,cGAS/STING signaling pathway,1/23,34/18860,0.0294117647058824,24.1176470588235,4.71434585003194,0.0406747249848036,0.215518917085157,0.177701063788955,LYPLAL1,1,BP,aortic aneurysm and dissection
GO:0000038,very long-chain fatty acid metabolic process,1/23,35/18860,0.0285714285714286,23.4285714285714,4.64072166332409,0.0418467467273598,0.215518917085157,0.177701063788955,SLC27A6,1,BP,aortic aneurysm and dissection
GO:0016072,rRNA metabolic process,2/23,270/18860,0.00740740740740741,6.07407407407407,2.93438010546598,0.0424012515135736,0.215518917085157,0.177701063788955,RRP15/WDR75,2,BP,aortic aneurysm and dissection
GO:0045943,positive regulation of transcription by RNA polymerase I,1/23,36/18860,0.0277777777777778,22.7777777777778,4.57010559263413,0.0430173987765106,0.215518917085157,0.177701063788955,WDR75,1,BP,aortic aneurysm and dissection
GO:0048048,embryonic eye morphogenesis,1/23,37/18860,0.027027027027027,22.1621621621622,4.50229407507461,0.0441866826602836,0.215518917085157,0.177701063788955,FBN2,1,BP,aortic aneurysm and dissection
GO:2001240,negative regulation of extrinsic apoptotic signaling pathway in absence of ligand,1/23,37/18860,0.027027027027027,22.1621621621622,4.50229407507461,0.0441866826602836,0.215518917085157,0.177701063788955,MAP2K5,1,BP,aortic aneurysm and dissection
GO:0032872,regulation of stress-activated MAPK cascade,1/23,38/18860,0.0263157894736842,21.5789473684211,4.43710238010042,0.0453545999050805,0.215518917085157,0.177701063788955,FAS,1,BP,aortic aneurysm and dissection
GO:0048730,epidermis morphogenesis,1/23,38/18860,0.0263157894736842,21.5789473684211,4.43710238010042,0.0453545999050805,0.215518917085157,0.177701063788955,FGF7,1,BP,aortic aneurysm and dissection
GO:0034390,smooth muscle cell apoptotic process,1/23,40/18860,0.025,20.5,4.31392089240377,0.0476863405752483,0.215518917085157,0.177701063788955,MAP2K5,1,BP,aortic aneurysm and dissection
GO:0035640,exploration behavior,1/23,40/18860,0.025,20.5,4.31392089240377,0.0476863405752483,0.215518917085157,0.177701063788955,MINAR2,1,BP,aortic aneurysm and dissection
GO:0060122,inner ear receptor cell stereocilium organization,1/23,40/18860,0.025,20.5,4.31392089240377,0.0476863405752483,0.215518917085157,0.177701063788955,MINAR2,1,BP,aortic aneurysm and dissection
GO:0090659,walking behavior,1/23,40/18860,0.025,20.5,4.31392089240377,0.0476863405752483,0.215518917085157,0.177701063788955,MINAR2,1,BP,aortic aneurysm and dissection
GO:0048873,homeostasis of number of cells within a tissue,1/23,43/18860,0.0232558139534884,19.0697674418605,4.14504240560183,0.0511737398550687,0.215518917085157,0.177701063788955,MINAR2,1,BP,aortic aneurysm and dissection
GO:1903115,regulation of actin filament-based movement,1/23,43/18860,0.0232558139534884,19.0697674418605,4.14504240560183,0.0511737398550687,0.215518917085157,0.177701063788955,ACTA2,1,BP,aortic aneurysm and dissection
GO:0030501,positive regulation of bone mineralization,1/23,44/18860,0.0227272727272727,18.6363636363636,4.09250397767214,0.0523334892297477,0.215518917085157,0.177701063788955,FBN2,1,BP,aortic aneurysm and dissection
GO:0090051,negative regulation of cell migration involved in sprouting angiogenesis,1/23,45/18860,0.0222222222222222,18.2222222222222,4.0416687243954,0.0534918826049449,0.215518917085157,0.177701063788955,MAP2K5,1,BP,aortic aneurysm and dissection
GO:0071560,cellular response to transforming growth factor beta stimulus,2/23,311/18860,0.00643086816720257,5.27331189710611,2.65522858714247,0.0546233859962913,0.215518917085157,0.177701063788955,ACTA2/FBN2,2,BP,aortic aneurysm and dissection
GO:0007099,centriole replication,1/23,46/18860,0.0217391304347826,17.8260869565217,3.99244419443015,0.0546489214941334,0.215518917085157,0.177701063788955,CEP152,1,BP,aortic aneurysm and dissection
GO:0060412,ventricular septum morphogenesis,1/23,46/18860,0.0217391304347826,17.8260869565217,3.99244419443015,0.0546489214941334,0.215518917085157,0.177701063788955,ADAMTS19,1,BP,aortic aneurysm and dissection
GO:0010463,mesenchymal cell proliferation,1/23,47/18860,0.0212765957446809,17.4468085106383,3.94474483838808,0.0558046074091774,0.215518917085157,0.177701063788955,FGF7,1,BP,aortic aneurysm and dissection
GO:0042254,ribosome biogenesis,2/23,318/18860,0.00628930817610063,5.15723270440252,2.61250413291765,0.0568232016903055,0.215518917085157,0.177701063788955,RRP15/WDR75,2,BP,aortic aneurysm and dissection
GO:0071559,response to transforming growth factor beta,2/23,318/18860,0.00628930817610063,5.15723270440252,2.61250413291765,0.0568232016903055,0.215518917085157,0.177701063788955,ACTA2/FBN2,2,BP,aortic aneurysm and dissection
GO:0048247,lymphocyte chemotaxis,1/23,48/18860,0.0208333333333333,17.0833333333333,3.89849135937609,0.0569589418603332,0.215518917085157,0.177701063788955,CH25H,1,BP,aortic aneurysm and dissection
GO:0070266,necroptotic process,1/23,48/18860,0.0208333333333333,17.0833333333333,3.89849135937609,0.0569589418603332,0.215518917085157,0.177701063788955,FAS,1,BP,aortic aneurysm and dissection
GO:0035850,epithelial cell differentiation involved in kidney development,1/23,50/18860,0.02,16.4,3.81003271347541,0.0592635624039791,0.215518917085157,0.177701063788955,ACTA2,1,BP,aortic aneurysm and dissection
GO:0043029,T cell homeostasis,1/23,50/18860,0.02,16.4,3.81003271347541,0.0592635624039791,0.215518917085157,0.177701063788955,FAS,1,BP,aortic aneurysm and dissection
GO:0051607,defense response to virus,2/23,334/18860,0.00598802395209581,4.91017964071856,2.51939633385901,0.061967758164608,0.217026324699533,0.178943961351085,IFIT2/IFIT1B,2,BP,aortic aneurysm and dissection
GO:0050731,positive regulation of peptidyl-tyrosine phosphorylation,1/23,53/18860,0.0188679245283019,15.4716981132075,3.68650685874787,0.0627103949044629,0.217026324699533,0.178943961351085,FGF7,1,BP,aortic aneurysm and dissection
GO:0048009,insulin-like growth factor receptor signaling pathway,1/23,54/18860,0.0185185185185185,15.1851851851852,3.64754831494007,0.0638566521978746,0.217026324699533,0.178943961351085,MAP2K5,1,BP,aortic aneurysm and dissection
GO:0060688,regulation of morphogenesis of a branching structure,1/23,55/18860,0.0181818181818182,14.9090909090909,3.60961432005584,0.0650015685543275,0.219434825388099,0.180929834054433,FGF7,1,BP,aortic aneurysm and dissection
GO:0045778,positive regulation of ossification,1/23,56/18860,0.0178571428571429,14.6428571428571,3.57265930573775,0.0661451454712778,0.220337802463925,0.181674362604974,FBN2,1,BP,aortic aneurysm and dissection
GO:0072132,mesenchyme morphogenesis,1/23,59/18860,0.0169491525423729,13.8983050847458,3.46725318376138,0.0695678545358018,0.222882998926805,0.183772944600107,ACTA2,1,BP,aortic aneurysm and dissection
GO:0034113,heterotypic cell-cell adhesion,1/23,61/18860,0.0163934426229508,13.4426229508197,3.40115844150856,0.0718429907630844,0.224453567415102,0.185067919978132,MAP2K5,1,BP,aortic aneurysm and dissection
GO:0070231,T cell apoptotic process,1/23,61/18860,0.0163934426229508,13.4426229508197,3.40115844150856,0.0718429907630844,0.224453567415102,0.185067919978132,FAS,1,BP,aortic aneurysm and dissection
GO:0043616,keratinocyte proliferation,1/23,63/18860,0.0158730158730159,13.015873015873,3.33809516280754,0.0741128050361775,0.22730939593413,0.187422626343093,FGF7,1,BP,aortic aneurysm and dissection
GO:0034198,cellular response to amino acid starvation,1/23,64/18860,0.015625,12.8125,3.30762655303024,0.075245720154769,0.228677300877763,0.188550500252879,FAS,1,BP,aortic aneurysm and dissection
GO:0039532,negative regulation of cytoplasmic pattern recognition receptor signaling pathway,1/23,65/18860,0.0153846153846154,12.6153846153846,3.27783046724056,0.0763773092394913,0.228677300877763,0.188550500252879,LYPLAL1,1,BP,aortic aneurysm and dissection
GO:1903409,reactive oxygen species biosynthetic process,1/23,65/18860,0.0153846153846154,12.6153846153846,3.27783046724056,0.0763773092394913,0.228677300877763,0.188550500252879,FAS,1,BP,aortic aneurysm and dissection
GO:0045185,maintenance of protein location,1/23,67/18860,0.0149253731343284,12.2388059701493,3.22015589475886,0.0786365152321595,0.229291179708197,0.189056659631746,FBN2,1,BP,aortic aneurysm and dissection
GO:1990928,response to amino acid starvation,1/23,67/18860,0.0149253731343284,12.2388059701493,3.22015589475886,0.0786365152321595,0.229291179708197,0.189056659631746,FAS,1,BP,aortic aneurysm and dissection
GO:0034394,protein localization to cell surface,1/23,68/18860,0.0147058823529412,12.0588235294118,3.19223063969901,0.0797641350985814,0.229291179708197,0.189056659631746,FGF7,1,BP,aortic aneurysm and dissection
GO:1905330,regulation of morphogenesis of an epithelium,1/23,69/18860,0.0144927536231884,11.8840579710145,3.16488420364439,0.080890434848088,0.229291179708197,0.189056659631746,FGF7,1,BP,aortic aneurysm and dissection
GO:0030199,collagen fibril organization,1/23,71/18860,0.0140845070422535,11.5492957746479,3.11184666748778,0.0831390798960071,0.229291179708197,0.189056659631746,ADAMTS19,1,BP,aortic aneurysm and dissection
GO:0061951,establishment of protein localization to plasma membrane,1/23,71/18860,0.0140845070422535,11.5492957746479,3.11184666748778,0.0831390798960071,0.229291179708197,0.189056659631746,LYPLAL1,1,BP,aortic aneurysm and dissection
GO:0050918,positive chemotaxis,1/23,72/18860,0.0138888888888889,11.3888888888889,3.08611747169506,0.08426142814032,0.229291179708197,0.189056659631746,FGF7,1,BP,aortic aneurysm and dissection
GO:0006360,transcription by RNA polymerase I,1/23,73/18860,0.0136986301369863,11.2328767123288,3.06089078176884,0.0853824621595219,0.229291179708197,0.189056659631746,WDR75,1,BP,aortic aneurysm and dissection
GO:0006893,Golgi to plasma membrane transport,1/23,73/18860,0.0136986301369863,11.2328767123288,3.06089078176884,0.0853824621595219,0.229291179708197,0.189056659631746,LYPLAL1,1,BP,aortic aneurysm and dissection
GO:0008544,epidermis development,2/23,402/18860,0.00497512437810945,4.07960199004975,2.18088455429034,0.0854831660217855,0.229291179708197,0.189056659631746,FGF7/MINAR2,2,BP,aortic aneurysm and dissection
GO:0006414,translational elongation,1/23,75/18860,0.0133333333333333,10.9333333333333,3.01187830862047,0.0876205933971639,0.229291179708197,0.189056659631746,SECISBP2L,1,BP,aortic aneurysm and dissection
GO:0071260,cellular response to mechanical stimulus,1/23,76/18860,0.0131578947368421,10.7894736842105,2.98806113640549,0.0887376935489808,0.229291179708197,0.189056659631746,FAS,1,BP,aortic aneurysm and dissection
GO:0016126,sterol biosynthetic process,1/23,77/18860,0.012987012987013,10.6493506493507,2.96468360235398,0.0898534853424414,0.229291179708197,0.189056659631746,CH25H,1,BP,aortic aneurysm and dissection
GO:0001558,regulation of cell growth,2/23,414/18860,0.00483091787439614,3.96135265700483,2.12890644550095,0.089884031620283,0.229291179708197,0.189056659631746,MAP2K5/DCC,2,BP,aortic aneurysm and dissection
GO:0071496,cellular response to external stimulus,1/23,78/18860,0.0128205128205128,10.5128205128205,2.94173173210708,0.0909679702403345,0.229291179708197,0.189056659631746,FAS,1,BP,aortic aneurysm and dissection
GO:0045669,positive regulation of osteoblast differentiation,1/23,79/18860,0.0126582278481013,10.379746835443,2.91919216929052,0.0920811497038884,0.229291179708197,0.189056659631746,FBN2,1,BP,aortic aneurysm and dissection
GO:0035914,skeletal muscle cell differentiation,1/23,83/18860,0.0120481927710843,9.87951807228916,2.8329096116757,0.09652084238487,0.233413383267258,0.192455525807889,COPS2,1,BP,aortic aneurysm and dissection
GO:2000027,regulation of animal organ morphogenesis,1/23,84/18860,0.0119047619047619,9.76190476190476,2.81225056295806,0.0976275165407603,0.234960003923457,0.19373075556313,FGF7,1,BP,aortic aneurysm and dissection
GO:0006400,tRNA modification,1/23,93/18860,0.010752688172043,8.81720430107527,2.64066244453263,0.107529406182685,0.251568796790189,0.207425145830982,DTWD1,1,BP,aortic aneurysm and dissection
GO:0043410,positive regulation of MAPK cascade,2/23,474/18860,0.00421940928270042,3.45991561181435,1.89532255577841,0.112856615718982,0.252695376394371,0.208354040597221,ACTA2/FGF7,2,BP,aortic aneurysm and dissection
GO:0006405,RNA export from nucleus,1/23,98/18860,0.0102040816326531,8.36734693877551,2.55506511983015,0.112985459080544,0.252695376394371,0.208354040597221,ZC3H11B,1,BP,aortic aneurysm and dissection
GO:0034340,response to type I interferon,1/23,99/18860,0.0101010101010101,8.28282828282828,2.53867470080931,0.114072834330578,0.252695376394371,0.208354040597221,CH25H,1,BP,aortic aneurysm and dissection
GO:0051781,positive regulation of cell division,1/23,99/18860,0.0101010101010101,8.28282828282828,2.53867470080931,0.114072834330578,0.252695376394371,0.208354040597221,FGF7,1,BP,aortic aneurysm and dissection
GO:0048640,negative regulation of developmental growth,1/23,101/18860,0.0099009900990099,8.11881188118812,2.50657521565651,0.11624376094131,0.252695376394371,0.208354040597221,DCC,1,BP,aortic aneurysm and dissection
GO:0022405,hair cycle process,1/23,102/18860,0.00980392156862745,8.03921568627451,2.49085514489276,0.117327315155199,0.252695376394371,0.208354040597221,FGF7,1,BP,aortic aneurysm and dissection
GO:0021510,spinal cord development,1/23,104/18860,0.00961538461538462,7.88461538461539,2.46004822058227,0.119490612521601,0.252695376394371,0.208354040597221,DCC,1,BP,aortic aneurysm and dissection
GO:0016049,cell growth,2/23,499/18860,0.00400801603206413,3.28657314629259,1.80885846113145,0.122853690139654,0.253259861230516,0.208819473317617,MAP2K5/DCC,2,BP,aortic aneurysm and dissection
GO:0006939,smooth muscle contraction,1/23,110/18860,0.00909090909090909,7.45454545454545,2.37234993052125,0.125950118380153,0.255455280424262,0.210629654676487,ACTA2,1,BP,aortic aneurysm and dissection
GO:0042632,cholesterol homeostasis,1/23,112/18860,0.00892857142857143,7.32142857142857,2.34457512673695,0.128093196012347,0.257813147254563,0.21257377842063,MINAR2,1,BP,aortic aneurysm and dissection
GO:0060761,negative regulation of response to cytokine stimulus,1/23,113/18860,0.00884955752212389,7.25663716814159,2.3309431511413,0.12916284912157,0.257813147254563,0.21257377842063,MAP2K5,1,BP,aortic aneurysm and dissection
GO:0072676,lymphocyte migration,1/23,114/18860,0.0087719298245614,7.19298245614035,2.31747655052861,0.130231246970304,0.257898886716782,0.212644472881474,CH25H,1,BP,aortic aneurysm and dissection
GO:0008637,apoptotic mitochondrial changes,1/23,116/18860,0.00862068965517241,7.06896551724138,2.29102541046806,0.132364282509567,0.260075133212157,0.21443884584198,IFIT2,1,BP,aortic aneurysm and dissection
GO:0070252,actin-mediated cell contraction,1/23,124/18860,0.00806451612903226,6.61290322580645,2.19117637893888,0.140846494751414,0.265314406693216,0.218758765799157,ACTA2,1,BP,aortic aneurysm and dissection
GO:0051224,negative regulation of protein transport,1/23,128/18860,0.0078125,6.40625,2.14450179679366,0.145057799244526,0.265314406693216,0.218758765799157,LYPLAL1,1,BP,aortic aneurysm and dissection
